Authors(seperated by '/');Document Title;DOI;Database;Affiliation Country;Publication Year;Keywords(seperated by '/');Cluster(seperated by '/')
D. Ge / X. Yao / Z. Lian;Binocular vision calibration and 3D re-construction with an orthogonal learning neural network;10.1007/s11042-015-2845-5;Springer;CHN;2016;Polymer material industry / Cloud manufacturing / Cloud computing / Big data;cloud computing / internet of things
G. Müller-Seitz / M. Seiter / P. Wenz;Empirische Themenfelder;10.1007/978-3-658-12642-1_3;Springer;USA;2016;Tolerance design / Cloud manufacturing / Evolutionary game / Nash equilibrium;industrial robot
S. Scholze / A. Correia / D. Stokic / K. Nagorny / P. Spindler;Tools for Human-Product Collaborative Development of Intelligent Product Service Systems;10.1007/978-3-319-45390-3_32;Springer;Other;2016;Cloud manufacturing (CMfg) / Trust evaluation / Intuitionistic fuzzy sets (IFS) / Time decay / The third-party trust evaluation;undefined
J. Wang / X. Li;Task scheduling for MapReduce in heterogeneous networks;10.1007/s10586-015-0503-3;Springer;IND;2016;Multiple manufacturing clouds / Cloud manufacturing / Interoperability / Collaboration;industry 4.0
Y. Hu / L. Ren / H. Zhao / Y. Wang;Feature Recognition Based on Fuzzy Neural Network for Clone Car;10.1007/978-981-10-2663-8_68;Springer;CHN;2016;Interval-valued hesitant fuzzy sets / Einstein operational laws / Prioritized aggregation operators / Multi-attribute group decision making;undefined
Y. Wang / J. Wei / C. Gao;Customization Design of Cloud Manufacturing Resources Based on Polychromatic Sets Theory;10.1109/IHMSC.2015.255;IEEE;Other;2015;Cloud manufacturing / cloud resources / customization design / polychromatic sets / product family;undefined
T. Chen;A PCA-BPN approach for estimating simulation workload in cloud manufacturing;10.1109/ICUFN.2015.7182658;IEEE;TWN;2015;Cloud manufacturing / ubiquitous / simulation workload / estimation / principal component analysis / back propagation network;industry 4.0
J. Yan / Q. Liu / W. Xu / D. T. Pham / C. Ji;Servitisation of fault diagnosis for mechanical equipment in cloud manufacturing;10.1109/INDIN.2015.7281799;IEEE;CHN;2015;fault diagnosis / servitisation / fault diagnosis / cloud manufacturing;industry 4.0
W. Li / C. Zhu / E. C. -. Ngai / L. T. Yang / L. Shu / Y. Sheng;Facilities collaboration in cloud manufacturing based on generalized collaboration network;undescribed;IEEE;CHN;2015;Social collaboration network / Complex networks / Cloud manufacturing / Scheduling / Clique / Degree distribution;industry 4.0
H. Li / L. Zhao / B. Zhang / J. Li;Service Matching and Composition Considering Correlations among Cloud Services;10.1109/SMC.2015.100;IEEE;Other;2015;Cloud manufacturing / Service reservation / Service correlation / Quality of service;internet of things
Y. Wang / S. Qiu / C. Gao / J. Wei;Cluster analysis on the service oriented alliance enterprise manufacturing resource;10.1109/ICAMechS.2015.7287118;IEEE;CHN;2015;Cloud manufacturing / intelligent resources / cluster analysis / resource cluster / manufacturing capacity;undefined
C. Yang / W. Shen / X. Wang / T. Lin;A Framework for Integrating Multiple Manufacturing Clouds;10.1109/SMC.2015.236;IEEE;Other;2015;multiple manufacturing clouds / Cloud manufacturing / interoperability / collaboration;industry 4.0
Y. Cheng / D. Zhao / F. Tao / L. Zhang / Y. Liu;Complex networks based manufacturing service and task management in cloud environment;10.1109/ICIEA.2015.7334119;IEEE;CHN;2015;service-oriented manufacturing (SOM) / manufacturing service network (S_Net) / manufacturing task network (T_Net) / service management / task management / cloud environment;service management
T. Sakakura;A speculation on a framework that provides highly organized services for manufacturing;10.1109/CoASE.2015.7294233;IEEE;Other;2015;manufacturing / service / efficiency / PLM / SCM / analitics;manufacturing
Y. Li / Q. Liu / J. Xiong / J. Wang;Research on data-sharing and intelligent CNC machining system;10.1109/ICMA.2015.7237557;IEEE;CHN;2015;data / sharing / intelligent / machining / CNC;industry 4.0 / ontology
C. Chen / M. Hung / Y. Lin / P. Li;Development of a Hybrid-Cloud-based Wheel-Manufacturing Service with Ontology inference for machine tools;10.1109/CoASE.2015.7294300;IEEE;TWN;2015;undescribed;undefined
X. Lu / S. Wang / W. Li / P. Jiang / C. Zhang;Development of a WSN based real time energy monitoring platform for industrial applications;10.1109/CSCWD.2015.7230982;IEEE;GBR;2015;Wireless sensor network / energy monitoring / sustainable manufacturing / Cloud service;internet of things / cloud computing
J. Wan / H. Cai / K. Zhou;Industrie 4.0: Enabling technologies;10.1109/ICAIOT.2015.7111555;IEEE;CHN;2015;Industrie 4.0 / cyber-physical systems / industrial wireless network / social manufacturing / cloud computing / big data;cloud computing / internet of things
S. Ramisetty / P. Calyam / J. Cecil / A. R. Akula / R. B. Antequera / R. Leto;Ontology integration for advanced manufacturing collaboration in cloud platforms;10.1109/INM.2015.7140329;IEEE;Other;2015;Integrated Cloud Management / Advanced Manufacturing / Ontology Service / App Marketplace;advanced manufacturing
Y. Li / Y. Zuo / F. Tao / D. Zhao;A brief review of complex networks in service oriented manufacturing system;10.1109/ICIEA.2015.7334242;IEEE;CHN;2015;service-oriented manufacturing / complex networks / cloud manufacturing / manufacturing services / resource services;industry 4.0
X. T. Cai / W. D. Li / F. Z. He / Y. Q. Wu;Operation-effects merging for collaborative design of personalized product;10.1109/CSCWD.2015.7231008;IEEE;CHN;2015;design intentions / collaborative CAD / operation effects / personalized product / merging;undefined
S. Gr&uuml / ner / U. Epple;Real-time properties for design of heterogeneous industrial automation systems;10.1109/IECON.2015.7392801;IEEE;DEU;2015;undescribed;undefined
D. Mourtzis / M. Doukas / C. Lalas / N. Papakostas;Cloud-based Integrated Shop-floor Planning and Control of Manufacturing Operations for Mass Customisation;10.1016/j.procir.2015.06.004.;Elsevier;Other;2015;Production Planning and Control / Mass Customisation / Decision-making / Software as a Service / Cloud Manufacturing;industry 4.0
R. Y. Zhong / G. Q. Huang / S. Lan / Q. Dai / X. Chen / T. Zhang;A big data approach for logistics trajectory discovery from RFID-enabled production data;10.1016/j.ijpe.2015.02.014.;Elsevier;USA;2015;RFID / Big data / Logistics control / Trajectory pattern / Shopfloor manufacturing;internet of things
H. Grierson / J. Corney / G. Hatcher;Using visual representations for the searching and browsing of large, complex, multimedia data sets;10.1016/j.ijinfomgt.2014.12.003.;Elsevier;Other;2015;Searching / Browsing / Information visualization / Information management / Zoomable;industry 4.0
A. James / J. Chung;Business and Industry Specific Cloud: Challenges and opportunities;10.1016/j.future.2014.12.006.;Elsevier;GBR;2015;Cloud / Industry-specific / Applications;industry 4.0
K. Muita / M. Westerlund / R. Rajala;The Evolution of Rapid Production: How to Adopt Novel Manufacturing Technology;10.1016/j.ifacol.2015.06.054.;Elsevier;DEU;2015;Rapid / Prototyping / Production systems / Products / Printers / Manufacturing;production system / manufacturing
E. H. Watanabe / M. F. Blos / R. M. d. Silva / F. Junqueira / D. J. S. Filho / P. E. Miyagi;A Framework to Evaluate the Performance of Disperse Productive System through Sustainability Performance Indicators;10.1016/j.ifacol.2015.06.325.;Elsevier;GBR;2015;sustainability / performance evaluation / Petri net / framework / disperse productive systems / cloud computing;ontology / industry 4.0 / internet of things / cloud computing
S. Tedeschi / J. Mehnen / N. Tapoglou / R. Rajkumar;Security Aspects in Cloud Based Condition Monitoring of Machine Tools;10.1016/j.procir.2015.07.046.;Elsevier;GBR;2015;Cloud / Remote Maintenance / Machine Tool / Secure Communications / Remote Monitoring;industry 4.0 / ontology
E. Rauch / M. Dallinger / P. Dallasega / D. T. Matt;Sustainability in Manufacturing through Distributed Manufacturing Systems (DMS);10.1016/j.procir.2015.01.069.;Elsevier;Other;2015;Distributed Manufacturing Systems (DMS) / Sustainable Manufacturing / Dispersed manufacturing;undefined
G. Guan / M. Hirsch / Z. H. Lu / D. T. Childs / S. J. Matcher / R. Goodridge / K. M. Groom / A. T. Clare;Evaluation of selective laser sintering processes by optical coherence tomography;10.1016/j.matdes.2015.09.084.;Elsevier;Other;2015;OCT / Selective laser sintering / AM / In-situ monitoring;undefined
A. Talhi / J. Huet / V. Fortineau / S. Lamouri;Towards a Cloud Manufacturing systems modeling methodology;10.1016/j.ifacol.2015.06.096.;Elsevier;USA;2015;Ontology / Cloud Manufacturing / ASDI / modeling;ontology
R. Gao / L. Wang / R. Teti / D. Dornfeld / S. Kumara / M. Mori / M. Helu;Cloud-enabled prognosis for manufacturing;10.1016/j.cirp.2015.05.011.;Elsevier;Other;2015;Predictive model / Condition monitoring / Cloud manufacturing;industry 4.0
O. Bakker / S. Ratchev / A. Popov;Towards a Condition-Monitoring Framework for Quality Assurance in Intelligent Multistage Manufacturing EnvironmentÕ;10.1016/j.ifacol.2015.06.397.;Elsevier;SWE;2015;Process monitoring / Manufacturing systems / Automation / Product quality / Multivariate quality control / Production systems / Decision making / Data processing / Signal processing;automation / industry 4.0 / production system
L. Wang / M. Törngren / M. Onori;Current status and advancement of cyber-physical systems in manufacturing;10.1016/j.jmsy.2015.04.008.;Elsevier;GBR;2015;undescribed;undefined
G. B. Panchal / V. Jain / S. Kumar;Multidimensional utility analysis in a two-tier supply chain;10.1016/j.jmsy.2014.07.001.;Elsevier;IND;2015;Supply chain management / Supply chain games / Supplier selection / Utility analysis / Equilibrium pricing / Social outcome;industry 4.0
J. Güttler / R. Shah / C. Georgoulas / T. Bock;Unobtrusive Tremor Detection and Measurement via Human-Machine Interaction;10.1016/j.procs.2015.08.369.;Elsevier;Other;2015;tremor / fast fourier transformation / smart glasses / parkinson / human-machine-interaction / leap motion controller;undefined
O. Morariu / T. Borangiu / S. Raileanu;vMES: Virtualization aware manufacturing execution system;10.1016/j.compind.2014.11.003.;Elsevier;Other;2015;MES / Virtualization / Private cloud / Shop floor / Resource allocation / ISA-95;industry 4.0 / cloud computing / ontology
X. Wang / M. Liu / M. Ge / L. Ling / C. Liu;Research on assembly quality adaptive control system for complex mechanical products assembly process under uncertainty;10.1016/j.compind.2015.09.001.;Elsevier;Other;2015;Complex mechanical products / Assembly quality adaptive control / Adaptive control system / BP neural network / Uncertainty;internet of things
L. Wang;An overview of function block enabled adaptive process planning for machining;10.1016/j.jmsy.2014.11.013.;Elsevier;USA;2015;Process planning / Function block / Job-shop machining / Uncertainty / Adaptability;industry 4.0 / internet of things
C. Yu / X. Xu / Y. Lu;Computer-Integrated Manufacturing, Cyber-Physical Systems and Cloud Manufacturing – Concepts and relationships;10.1016/j.mfglet.2015.11.005.;Elsevier;Other;2015;Cloud Manufacturing / Cyber-Physical Systems / Computer Integrated Manufacturing / Industry 4.0 / Internet of Things;industry 4.0 / internet of things
S. Kothari / T. Peck / J. Zeng / F. Oblea / A. E. Votaw / G. Dispoto;Simulation as a cloud service for short-run high throughput industrial print production using a service broker architecture;10.1016/j.simpat.2015.05.003.;Elsevier;CHN;2015;Stochastic discrete event simulation / Print production modeling / Print production simulation / Cloud service / Simulation as a service / System design / Service broker architecture / High throughput industrial print production;cloud computing
D. Wu / J. Terpenny / W. Gentzsch;Cloud-Based Design, Engineering Analysis and Manufacturing: A Cost-Benefit Analysis;10.1016/j.promfg.2015.09.061.;Elsevier;Other;2015;Cloud-based design and manufacturing / Cloud-based engineering analysis / Cloud computing / High performance computing / Cost-benefit analysis;cloud computing / service management
Z. Wu / Z. Gao / Y. Cao / X. Ye / J. Yang;Tolerance Design and Adjustment of Complex Customized Product Based on Cloud Manufacturing;10.1016/j.procir.2015.04.061.;Elsevier;USA;2015;cloud manufacturing / quality loss / manufacturing cost / dynamic tolerance adjustment;ontology
M. Helu / K. Morris / K. Jung / K. Lyons / S. Leong;Identifying performance assurance challenges for smart manufacturing;10.1016/j.mfglet.2015.11.001.;Elsevier;SWE;2015;Smart manufacturing / Performance assurance / Risk assessment / Standards;internet of things
G. Riexinger / P. Holtewert / A. Bruns / S. Wahren / K. Tran / T. Bauernhansl;KPI-focused Simulation and Management System for Eco-Efficient Design of Energy-Intensive Production Systems;10.1016/j.procir.2015.02.029.;Elsevier;ITA;2015;Eco-efficient design / Key performance indicators / Production simulation / Integrated systems / Production planning / Production optimization / DAPhNE;industry 4.0
J. Morgan / G. E. O’Donnell;The Cyber Physical Implementation of Cloud Manufactuirng Monitoring Systems;10.1016/j.procir.2015.06.007.;Elsevier;CHN;2015;Manufacturing / Monitoring / Service Orient Architecture;manufacturing
H. Huang / Y. Lin / M. Hung / C. Tu / F. Cheng;Development of cloud-based automatic virtual metrology system for semiconductor industry;10.1016/j.rcim.2015.01.005.;Elsevier;USA;2015;Automatic virtual metrology (AVM) / Factory-wide deployment / Cloud computing / Virtualization / Production quality prediction of wafer / Cloud-based AVM system;cloud computing / industry 4.0
D. Wu / D. W. Rosen / L. Wang / D. Schaefer;Cloud-based design and manufacturing: A new paradigm in digital manufacturing and design innovation;10.1016/j.cad.2014.07.006.;Elsevier;ITA;2015;Cloud-based design and manufacturing / Collaborative design / Distributed manufacturing / Design innovation / Digital manufacturing;industry 4.0 / digital manufacturing
S. Guo / B. Du / Z. Peng / X. Huang / Y. Li;Manufacturing resource combinatorial optimization for large complex equipment in group manufacturing: A cluster-based genetic algorithm;10.1016/j.mechatronics.2015.03.005.;Elsevier;Other;2015;Group manufacturing / Combinatorial optimization / Large complex equipment / Manufacturing resource cluster / Order task chain / Cluster-based genetic algorithm;industry 4.0
A. Mollajan / M. Houshmand;A Statistical Solution to Mitigate Functional Requirements Coupling Generated from Process (Manufacturing) Variables Integration-part I;10.1016/j.procir.2015.07.070.;Elsevier;CHN;2015;Independence Axiom / Noise Factors / Process (Manufacturing) Variables Integration / Partial & Semi-partial Correlation Analysis;industry 4.0
A. Azhar / M. Risby / A. S. Sohaimi / M. Hafizi / S. Khalis / S. Asrul;Conceptual Mold Design for Multi-curved Natural Fiber Reinforced Composite Body Armor Panel;10.1016/j.procir.2015.08.017.;Elsevier;CHN;2015;Compression mold / natural fiber / total design method / curvature;undefined
M. Moghaddam / J. R. Silva / S. Y. Nof;Manufacturing-as-a-Service—From e-Work and Service-Oriented Architecture to the Cloud Manufacturing Paradigm;10.1016/j.ifacol.2015.06.186.;Elsevier;IND;2015;Manufacturing Paradigm / Collaborative Control Theory (CCT) / Service design;industry 4.0
X. V. Wang / L. Wang;WRCloud: A Novel WEEE Remanufacturing Cloud System;10.1016/j.procir.2015.02.011.;Elsevier;Other;2015;Cloud Manufacturing / Cloud Remanufacturing / WEEE / WEEE Recovery / WEEE Recycle;undefined
T. L. Vinh / S. Bouzefrane / J. Farinone / A. Attar / B. P. Kennedy;Middleware to Integrate Mobile Devices, Sensors and Cloud Computing;10.1016/j.procs.2015.05.061.;Elsevier;Other;2015;Internet of Things / Mobile Cloud Comupting / Smart City / Service Architecture.;internet of things
S. Mishra / S. Malik / N. Jain / S. Jain;A Realist Framework for Ontologies and the Semantic Web;10.1016/j.procs.2015.10.087.;Elsevier;Other;2015;undescribed;undefined
Contents;IFAC-PapersOnLine;10.1016/S2405-8963(15)00770-3.;Elsevier;USA;2015;undescribed;undefined
A. Brant / M. M. Sundaram;A novel system for cloud-based micro additive manufacturing of metal structures;10.1016/j.jmapro.2015.06.020.;Elsevier;GBR;2015;Cloud-manufacturing / Additive manufacturing / Electrochemical deposition;additive manufacturing
T. Bock;The future of construction automation: Technological disruption and the upcoming ubiquity of robotics;10.1016/j.autcon.2015.07.022.;Elsevier;SWE;2015;Construction automation / Robotics in construction / Ambient integrated robotics / S-curves;undefined
H. Lee / J. Zhou / P. Hsu;The role of innovation in inventory turnover performance;10.1016/j.dss.2015.02.010.;Elsevier;USA;2015;Product innovation / Process innovation / Inventory turnover / Innovation spillover;undefined
J. Zhang / K. Agyapong-Kodua;Integrated Ontologies in Support of Factory Systems Design;10.1016/j.ifacol.2015.06.398.;Elsevier;SWE;2015;Product (P)-Process (P) and Resource (R) ontologies / Semantic Technologies / Factory systems / Digital Factory;industry 4.0
P. Galambos / Á. Csapó / P. Zentay / I. M. Fülöp / T. Haidegger / P. Baranyi / I. J. Rudas;Design, programming and orchestration of heterogeneous manufacturing systems through VR-powered remote collaboration;10.1016/j.rcim.2014.08.012.;Elsevier;DEU;2015;Virtual reality/augmented reality / Mixed virtual and physical reality / Remote collaboration / Virtual commissioning / Future internet / Cognitive infocommunications;undefined
L. Wang / A. J. Shih;Editorial for JMS special issue on Advanced Manufacturing Research;10.1016/j.jmsy.2015.05.001.;Elsevier;USA;2015;undescribed;undefined
G. Niharika / V. Ritu;Cloud Architecture for the Logistics Business;10.1016/j.procs.2015.04.013.;Elsevier;CHN;2015;Cloud Architecture / LAS / Barcodes / RFID / Tags / Label / Logistics.;undefined
S. Mejjaouli / R. F. Babiceanu;RFID-wireless sensor networks integration: Decision models and optimization of logistics systems operations;10.1016/j.jmsy.2015.02.005.;Elsevier;CHN;2015;Logistics systems / Decision making / RFID tags / Wireless sensor networks / Perishable products transportation;industry 4.0 / internet of things
J. R. Silva / S. Y. Nof;Manufacturing Service: From e-Work and Service-Oriented Approach towards a Product-Service Architecture;10.1016/j.ifacol.2015.06.319.;Elsevier;TWN;2015;e-Work / Manufacturing service / Manufacturing grid / Product - service architecture (PSA);undefined
V. Ostasevicius / V. Markevicius / V. Jurenas / M. Zilys / M. Cepenas / L. Kizauskiene / V. Gyliene;Cutting tool vibration energy harvesting for wireless sensors applications;10.1016/j.sna.2015.07.014.;Elsevier;TWN;2015;Vibration energy harvesting / Piezo generator / Wireless sensor node;undefined
Q. Zhao / L. Wei / H. Shu;Research on Credibility Support Mechanism of Manufacturing Cloud Service Based on Classified QoS;10.2991/978-94-6239-100-0_12;Springer;CHN;2015;Classified qos / Cloud manufacturing / Credibility support / Manufacturing cloud service;undefined
S. Yu / X. Xu;Development of a Product Configuration System for Cloud Manufacturing;10.1007/978-3-319-22759-7_51;Springer;USA;2015;Cloud manufacturing / Complex system / Modeling framework / Resource service sharing;undefined
A. Talhi / J. Huet / V. Fortineau / S. Lamouri;Toward an Ontology-Based Architecture for Cloud Manufacturing;10.1007/978-3-319-15159-5_18;Springer;NZL;2015;Sensor-based real-time monitoring / Complex event processing / Big Data / Cloud manufacturing;internet of things
Y. Lu / X. Xu;Protecting Intellectual Property in a Cloud Manufacturing Environment: Requirements and Strategies;10.1007/978-3-319-22759-7_47;Springer;CHN;2015;Ubiquitous manufacturing / Cloud computing / Internet of things / u-Maintenance;cloud computing / internet of things
Y. Cao / S. Wang / L. Kang / C. Li / L. Guo;Study on machining service modes and resource selection strategies in cloud manufacturing;10.1007/s00170-015-7222-z;Springer;CHN;2015;Cloud manufacturing / Cloud / Production management / Cloud production / ICMS;industry 4.0
L. Guo / S. Wang / L. Kang / Y. Cao;Agent-based manufacturing service discovery method for cloud manufacturing;10.1007/s00170-015-7221-0;Springer;SWE;2015;intelligent / service-oriented / shared / database / monitor / optimization / evaluation;internet of things
N. Tapoglou / J. Mehnen;A Framework for Cloud Manufacturing Enabled Optimisation for Machining;10.1007/978-3-319-22759-7_42;Springer;CHN;2015;Cloud Computing / Virtual Machine / Directed Acyclic Graph / Intelligent Algorithm / Immune Algorithm;cloud computing / internet of things / industry 4.0
T. Peng / S. Fang / R. Tang;Resource Utilization in Cloud Manufacturing – An Energy Perspective;10.1007/978-3-319-22759-7_44;Springer;Other;2015;One-of-a-kind production / Cloud manufacturing / Product planning / Quality function deployment;industry 4.0 / internet of things
P. Zou / L. Jiang / S. Liu;Collaborative After-Sales Service in the Cloud Manufacturing;10.1007/978-3-642-40660-7_12;Springer;NZL;2015;SOA / CPS / cloud manufacturing;undefined
E. C. Moraes / H. A. Lepikson / A. W. Colombo;Developing Interfaces Based on Services to the Cloud Manufacturing: Plug and Produce;10.1007/978-3-662-47200-2_86;Springer;CHN;2015;Industrial robot systems / Sustainable manufacturing capability / Unified model / Ontology;ontology
Q. Liu / K. Bao / Y. Fang / T. Huang / Z. Li;Distributed Identical Grating Sensing System Oriented to Equipment Intelligent Sense in Cloud Manufacturing;10.1007/978-3-319-22759-7_43;Springer;CHN;2015;Cloud manufacturing / Optimization / Machining / CNC;ontology
X. Wu / X. Jiang / W. Xu / Q. Ai / Q. Liu;A Unified Sustainable Manufacturing Capability Model for Representing Industrial Robot Systems in Cloud Manufacturing;10.1007/978-3-319-22759-7_45;Springer;Other;2015;Cloud manufacturing / After-sales service / Enterprise collaboration;undefined
P. Zheng / X. Xu / S. Q. Xie;Integrate Product Planning Process of OKP Companies in the Cloud Manufacturing Environment;10.1007/978-3-319-22759-7_49;Springer;CHN;2015;Energy consumption / Cloud manufacturing / Resource utilization / Framework;advanced manufacturing
L. Xie / X. Jiang / W. Xu / Q. Wei / R. Li / Z. Zhou;Dynamic Assessment of Sustainable Manufacturing Capability for CNC Machining Systems in Cloud Manufacturing;10.1007/978-3-319-22759-7_46;Springer;NZL;2015;Fiber optic sensor / Intelligent sense / Cloud manufacturing;undefined
Y. Liu / X. Xu / L. Zhang / F. Tao;A Modeling Framework for Resource Service Sharing in a Cloud Manufacturing System;10.1007/978-3-319-22759-7_48;Springer;CHN;2015;Cloud manufacturing / Intellectual property protection / Security policy;undefined
Y. Laili / F. Tao / L. Zhang;Computing Resource Allocation with PEADGA;10.1007/978-3-319-08840-2_10;Springer;GBR;2015;Cloud manufacturing / Service discovery / Multi-agent / JADE;undefined
X. V. Wang / L. Wang / M. Givehchi;ICMS: A Cloud-Based System for Production Management;10.1007/978-3-319-22759-7_52;Springer;Other;2015;Product configuration / Cloud manufacturing / Everything-as-a-service / Ontology;industry 4.0 / ontology
R. F. Babiceanu / R. Seker;Manufacturing Cyber-Physical Systems Enabled by Complex Event Processing and Big Data Environments: A Framework for Development;10.1007/978-3-319-15159-5_16;Springer;NZL;2015;Sustainable manufacturing capability / CNC machining systems / Dynamic assessment / “Vertical and horizontal” method;undefined
Y. Li / Q. Liu / R. Tong / X. Cui;Shared and service-oriented CNC machining system for intelligent manufacturing process;10.3901/CJME.2015.1010.119;Springer;CHN;2015;Big Data / Manufacturing / Product lifecycle management / Potential application;internet of things / manufacturing / industry 4.0
D. Husejnagić / A. Sluga;A conceptual framework for a ubiquitous autonomous work system in the Engineer-To-Order environment;10.1007/s00170-015-6798-7;Springer;CHN;2015;Cloud manufacturing / Ontology / Architecture / HMS;ontology / architecture
H. Kühnle / G. Bitsch;Description of the Working Field;10.1007/978-3-319-18078-6_2;Springer;CHN;2015;IoT / Cyber physical framework / Advanced manufacturing;advanced manufacturing
B. Yan / T. Lee / T. Lee;Mapping the intellectual structure of the Internet of Things (IoT) field (2000–2014): a co-word analysis;10.1007/s11192-015-1740-1;Springer;DEU;2015;Cloud computing / Networked collaborative / Semantic identification / Task assigned / Task marched / Technical service;cloud computing
M. A. Pisching / F. Junqueira / D. J. S. Filho / P. E. Miyagi;Service Composition in the Cloud-Based Manufacturing Focused on the Industry 4.0;10.1007/978-3-319-16766-4_7;Springer;USA;2015;Cloud computing / Cloud logistics / Service mode;cloud computing
G. D. Orio / D. Barata / A. Rocha / J. Barata;A Cloud-Based Infrastructure to Support Manufacturing Resources Composition;10.1007/978-3-319-16766-4_9;Springer;CHN;2015;Private cloud / Virtualization / Smart manufacturing / Redundancy / Fault tolerance / CoBASA / Event driven;cloud computing / industry 4.0 / internet of things / event driven
Shui / P. Lei / T. Qu / Zong / Z. Wang / X. Chen / H. Luo / G. Q. Huang;Cloud-Based Production Logistics Synchronization Mechanism and Method;10.1007/978-3-319-22759-7_53;Springer;CHN;2015;Cloud Computing / Pareto Front / Directed Acyclic Graph / User Request / Pareto Solution;cloud computing / industry 4.0
H. Kühnle / G. Bitsch;Smart Manufacturing Units;10.1007/978-3-319-18078-6_5;Springer;CHN;2015;Hybrid Algorithm / Mapping Rule / Cloud Manufacturing / Operator Portfolio / Dynamic Configuration;undefined
