Authors(seperated by '/');Document Title;DOI;Database;Affiliation Country;Publication Year;Keywords(seperated by '/');Cluster(seperated by '/')
I. Gräler / A. Pöhler;Intelligent Devices in a Decentralized Production System Concept;10.1016/j.procir.2017.12.186.;Elsevier;Other;2018;Adaptive manufacturing / Production planning / Reconfiguration;industry 4.0
A. G. Uriarte / A. H. Ng / M. U. Moris;Supporting the lean journey with simulation and optimization in the context of Industry 4.0;10.1016/j.promfg.2018.06.097.;Elsevier;USA;2018;Lean / Simulation / Optimization / Industry 40 / Simulation-based optimization / Decision-making;internet of things / industry 4.0
R. Hamzeh / R. Zhong / X. W. Xu;A Survey Study on Industry 4.0 for New Zealand Manufacturing;10.1016/j.promfg.2018.07.007.;Elsevier;USA;2018;Industry 4.0 / manufacturing / New Zealand industry;industry 4.0 / manufacturing
M. Mladineo / S. Celar / L. Celent / M. Crnjac;Selecting manufacturing partners in push and pull-type smart collaborative networks;10.1016/j.aei.2018.08.001.;Elsevier;USA;2018;Collaborative systems / Social manufacturing / Production networks / Industry 4.0 / Multi-objective optimization / HUMANT algorithm;industry 4.0
S. L. Chan / Y. Lu / Y. Wang;Data-driven cost estimation for additive manufacturing in cybermanufacturing;10.1016/j.jmsy.2017.12.001.;Elsevier;NZL;2018;Data analytics / Big data / Machine learning / LASSO / Elastic net / Additive manufacturing / Cybermanufacturing;internet of things / additive manufacturing
A. Hirscher / K. Niinimäki / C. M. J. Armstrong;Social manufacturing in the fashion sector: New value creation through alternative design strategies?;10.1016/j.jclepro.2017.11.020.;Elsevier;CHN;2018;Social manufacturing / Value creation / Value / Sustainable business models / Participatory design / Do-it-yourself / Do-it-together / Fashion;internet of things / ontology
L. Damiani / M. Demartini / G. Guizzi / R. Revetria / F. Tonelli;Augmented and virtual reality applications in industrial systems: A qualitative review towards the industry 4.0 era;10.1016/j.ifacol.2018.08.388.;Elsevier;CHN;2018;augmented reality / virtual reality / industry 4.0 / smart manufacturing / virtual factory / practical application / virtual training / manufacturing systems / advanced human-machine interaction technologies / manufacturing operations management;industry 4.0 / distributed computing / internet of things
P. Tiernan / G. O’Connor;Design, manufacture and test of a high temperature tensile and compression testing device;10.1016/j.promfg.2018.10.116.;Elsevier;ITA;2018;Elevated Temperature / Tensile/Compression Testing / Metallic Materials;undefined
H. S. Sucuoglu / I. Bogrekci / A. Gultekin / P. Demircioglu;Design, Analysis and Development of Mobile Robot with Flip-Flop Motion Ability;10.1016/j.ifacol.2018.11.323.;Elsevier;CHN;2018;Computer aided design / Computer aided engineering / Flip-Flop motion / Fused deposition modelling / Rapid prototyping / Rigid body dynamics / Suspension system;industry 4.0
Z. Al-Shara / F. Alvares / H. Bruneliere / J. Lejeune / C. Prud’Homme / T. Ledoux;CoMe4ACloud: An end-to-end framework for autonomic Cloud systems;10.1016/j.future.2018.03.039.;Elsevier;USA;2018;Cloud Computing / Autonomic Computing / Model Driven Engineering / Constraint Programming;cloud computing / internet of things
S. Rahimifard / J. Stone / P. Lumsakul / H. Trollman;Net Positive Manufacturing: A Restoring, Self-healing and Regenerative Approach to Future Industrial Development;10.1016/j.promfg.2018.02.088.;Elsevier;CHN;2018;Sustinable Manufacturing / Sustainable Manufacturing / Resource Efficiency / Regenerative Self-healing Industrial Systems;industry 4.0
M. Biron;Chapter 8 - Plastics Rush Into Digitalization Through Industry 4.0;10.1016/B978-0-08-102501-7.00008-4.;Elsevier;CHN;2018;3D printing / cobot / design / digitalization / management / market / robotic / sensor / software / virtual testing;3D printing / industrial robot / internet of things / service management
I. Kucukoglu / H. Atici-Ulusu / T. Gunduz / O. Tokcalar;Application of the artificial neural network method to detect defective assembling processes by using a wearable technology;10.1016/j.jmsy.2018.10.001.;Elsevier;USA;2018;Industry 4.0 / Wearable device / Artificial neural network / Signal classification;industry 4.0 / internet of things
P. Zheng / T. Lin / C. Chen / X. Xu;A systematic design approach for service innovation of smart product-service systems;10.1016/j.jclepro.2018.08.101.;Elsevier;CHN;2018;Data-driven design / Smart / Connected product / Digital twin / Product-service systems / Value creation;industry 4.0 / internet of things
N. Tuptuk / S. Hailes;Security of smart manufacturing systems;10.1016/j.jmsy.2018.04.007.;Elsevier;USA;2018;Smart manufacturing / Sustainable manufacturing / Design for manufacturing / Internet of Things / Information security / Cyber-physical systems;internet of things / ontology
B. Jeon / S. Suh;Design Considerations and Architecture for Cooperative Smart Factory: MAPE/BD Approach;10.1016/j.promfg.2018.07.146.;Elsevier;USA;2018;Smart Factory / Smart manufacturing / MAPE/BD / System Architetcure / cooperation;internet of things / industry 4.0
T. Paschou / F. Adrodegari / M. Rapaccini / N. Saccani / M. Perona;Towards Service 4.0: a new framework and research priorities;10.1016/j.procir.2018.03.300.;Elsevier;CHN;2018;digital servitization / digital technologies / framework / literature review / future research;industry 4.0
D. L. Nuñez / M. Borsato;OntoProg: An ontology-based model for implementing Prognostics Health Management in mechanical machines;10.1016/j.aei.2018.10.006.;Elsevier;Other;2018;Prognostics Health Management / Failure analysis / Ontology engineering;internet of things
A. H. Alavi / P. Jiao / W. G. Buttlar / N. Lajnef;Internet of Things-enabled smart cities: State-of-the-art and future trends;10.1016/j.measurement.2018.07.067.;Elsevier;NZL;2018;Internet of Things / Smart cities / Cloud computing / Network connectivity / Smart infrastructure;internet of things / cloud computing
L. Angeles-Martinez / C. Theodoropoulos / E. Lopez-Quiroga / P. J. Fryer / S. Bakalis;The Honeycomb model: A platform for systematic analysis of different manufacturing scenarios for fast-moving consumer goods;10.1016/j.jclepro.2018.04.075.;Elsevier;SWE;2018;Distributed manufacturing / Centralized manufacturing / Sustainability / Process optimization / MINLP / Fast-moving consumer goods;industry 4.0 / ontology
A. Fougères / E. Ostrosi;Intelligent agents for feature modelling in computer aided design;10.1016/j.jcde.2017.11.001.;Elsevier;CHN;2018;CAD modelling / Intelligent features / Feature recognition / Geometric knowledge / Intelligent agents / Emerged agent;industry 4.0
M. Parasol;The impact of China's 2016 Cyber Security Law on foreign technology firms and on China's big data and Smart City dreams;10.1016/j.clsr.2017.05.022.;Elsevier;CHN;2018;China / Big data / The Internet of Things / Smart Cities / Network Sovereignty / Rule of Law / Cyber Security Laws;internet of things
L. Ferreira / G. D. Putnik / N. Lopes / W. Garcia / M. M. Cruz-Cunha / H. Castro / M. L. Varela / J. M. Moura / V. Shah / C. Alves / Z. Putnik;Disruptive data visualization towards zero-defects diagnostics;10.1016/j.procir.2017.12.270.;Elsevier;SWE;2018;Disruptive data visualization / Zero-defects diagnostics / Manufacturing systems / industry 4.0 / IoT;industry 4.0
J. Hong / Y. Zhang / M. Ding;Sustainable supply chain management practices, supply chain dynamic capabilities and enterprise performance;10.1016/j.jclepro.2017.06.093.;Elsevier;CHN;2018;Sustainable supply chain management / Supply chain dynamic capabilities / Enterprise performance / Practices;undefined
T. Xia / Y. Dong / L. Xiao / S. Du / E. Pan / L. Xi;Recent advances in prognostics and health management for advanced manufacturing paradigms;10.1016/j.ress.2018.06.021.;Elsevier;DEU;2018;Prognostics and health management / Prognostics approaches / Maintenance management / Advanced manufacturing paradigms;undefined
T. Masood / J. Egger / M. Kern;Future-proofing the Through-life Engineering Service Systems;10.1016/j.promfg.2018.10.162.;Elsevier;GBR;2018;Future-proofing / Through-life Engineering Service Systems / TESS / Industrial Augmented Reality / AR / Resilince / Disruption Management / Change Prediction / Change Management;undefined
A. Zarreh / C. Saygin / H. Wan / Y. Lee / A. Bracho;A game theory based cybersecurity assessment model for advanced manufacturing systems;10.1016/j.promfg.2018.07.162.;Elsevier;CHN;2018;Game Theory / Cybersecurity in Manufacturing / Best Strategy for Defense;industrial robot
I. Zolotová / P. Papcun / E. Kajáti / M. Miškuf / J. Mocnej;Smart and cognitive solutions for Operator 4.0: Laboratory H-CPPS case studies;10.1016/j.cie.2018.10.032.;Elsevier;CHN;2018;Industry 4.0 / Operator 4.0 / Cognitive solutions / Human Cyber-Physical Production Systems;industry 4.0
A. Hu / L. Jing / S. Liu / Z. Wang / J. Wang;Key Issues of Cloud Manufacturing Applied to Agricultural Production;10.1109/IECON.2018.8592860;IEEE;CHN;2018;cloud manufacturing / agricultural cloud manufacturing / fertigation technology;undefined
L. Rui / D. Guijiang;An Application of MBD Based Inspection in Cloud Manufacturing;10.1109/IECON.2018.8591520;IEEE;CHN;2018;cloud manufacturing / model based definition / model based inspection / integration / data model;undefined
L. Zhou / L. Zhang / L. Ren;Simulation of Production Modes for Cloud Manufacturing Enterprises;10.1109/UV.2018.8642129;IEEE;CHN;2018;cloud manufacturing / production mode / enterprise / simulation;internet of things
J. Wang / K. Pan / Y. Guo;Collaborative Production Planning with Order Splitting in Cloud Manufacturing Platform;10.1109/DCABES.2018.00023;IEEE;Other;2018;collaborative production planning / order splitting / cloud manufacturing;undefined
P. Lou / Z. Xu / J. Yan / X. Zhang / J. Hu;The Effect of Relationship Structures on Cooperative Behaviors in a Cloud Manufacturing Environment;10.1109/ICISE.2018.00034;IEEE;Other;2018;Cloud Manufacturing / relationship structure / evolutionary game theory / agent-based modeling / simulation;internet of things
C. Ellwein / O. Riedel / O. Meyer / D. Schel;Rent'n'Produce: A Secure Cloud Manufacturing Platform for Small and Medium Enterprises;10.1109/ICE.2018.8436332;IEEE;DEU;2018;Cloud Manufacturing / Security / Industrial IoT / OPC UA Gateway;industry 4.0
T. Li / T. He / Z. Wang / Y. Zhang;An Approach to Iot Service Optimal Composition for Mass Customization on Cloud Manufacturing;10.1109/ACCESS.2018.2869275;IEEE;CHN;2018;IoT services / service composition / mass customization / cloud manufacturing;internet of things
C. Chen / M. Hung / P. Li / Y. Lin / Y. Liu / F. Cheng;A Novel Automated Construction Scheme for Efficiently Developing Cloud Manufacturing Services;10.1109/LRA.2018.2799420;IEEE;TWN;2018;Intelligent and flexible manufacturing / middleware and programming environments / cloud manufacturing service / fast automated construct scheme;undefined
S. M. N. A. Sunny / X. Liu / M. R. Shahriar;Remote Monitoring and Online Testing of Machine Tools for Fault Diagnosis and Maintenance Using MTComm in a Cyber-Physical Manufacturing Cloud;10.1109/CLOUD.2018.00074;IEEE;Other;2018;MTComm / Cloud based fault diagnosis / Remote online testing / Cyber-physical manufacturing cloud;undefined
L. Zhou / L. Zhang / L. Ren;Simulation Model of Dynamic Service Scheduling in Cloud Manufacturing;10.1109/IECON.2018.8592864;IEEE;CHN;2018;cloud manufacturing / service scheduling / model / simulation;model / internet of things
C. Sassanelli / S. Terzi / C. Pinna;A Model to Classify Manufacturing Archetypes for Distributed Production;10.1109/ICE.2018.8436366;IEEE;ITA;2018;distributed manufacturing / cloud manufacturing / customer involvement / archetypes;industry 4.0
B. Gao / S. Wang / L. Kang / X. Shu / X. Yang;Diagnosis and Handling of Exception in Cloud Manufacturing;10.1109/PHM-Chongqing.2018.00155;IEEE;Other;2018;Diagnosis; exception; cloud manufacturing; handling;undefined
P. Waibel / S. Videnov / M. Borkowski / C. Hochreiner / S. Schulte / J. Mendling;Process Simulation for Machine Reservation in Cloud Manufacturing;10.1109/INDIN.2018.8472038;IEEE;Other;2018;Business Process Enactment / Manufacturing Process Simulation / Cloud Manufacturing / BPMN;undefined
P. Lou / J. Guo / J. Yan / X. Jiang / J. Hu;Behavior Simulation of Manufacturing Services in a Cloud Manufacturing Environment;10.1109/ICISE.2018.00033;IEEE;Other;2018;cloud manufacturing / cooperative relationship / behavior learning mechanism / repeated interaction / willingness of cooperation;undefined
G. Chao / Q. Shiyou / X. Yingying / W. Mei / S. Guoqiang / L. Tingyu / X. Junjie / J. Zhengxuan;Diffusion mechanism simulation of cloud manufacturing complex network based on cooperative game theory;10.21629/JSEE.2018.02.13;IEEE;CHN;2018;complex network / cloud manufacturing / innovation diffusion / network effect / Gale-Shapley algorithm / cooperative game theory;industry 4.0
W. Qingming / L. Yafei / G. Peng;Research on cloud manufacturing order shipping scheme based on distribution center location;10.1109/ICITM.2018.8333931;IEEE;CHN;2018;cloud manufacturing / order transportation / distribution center / genetic algorithm;industry 4.0
K. Burow / K. Hribernik / K. Thoben;First Steps for a 5G-Ready Service in Cloud Manufacturing;10.1109/ICE.2018.8436312;IEEE;DEU;2018;Smart Factory / cloud manufacturing / 5G-ready application;undefined
P. Lou / L. Yuan / J. Hu / J. Yan / J. Fu;A Comprehensive Assessment Approach to Evaluate the Trustworthiness of Manufacturing Services in Cloud Manufacturing Environment;10.1109/ACCESS.2018.2837664;IEEE;CHN;2018;Cloud manufacturing / trust evaluation / credit assessment / reliability assessment / FAHP / MLR;undefined
C. Zhao / L. Zhang / X. Luo;Study on Modeling and Evaluation Method of Service-agent Network in Cloud Manufacturing;10.1109/UV.2018.8642147;IEEE;CHN;2018;Cloud manufacturing / Service agent / Set pair analysis / Modeling and Simulation;industry 4.0
Y. Liu / X. Li / L. Wang / B. Du;Outsourcing Resource Combinatorial Optimization of Complex Product in Cloud Manufacturing;10.1109/ICISCE.2018.00183;IEEE;Other;2018;Cloud manufacturing / Combinatorial optimization / Outsourcing resource / Self-adaptive genetic algorithm;industry 4.0
S. Lin / Y. Laili / Y. Luo;Integrated optimization of supplier selection and service scheduling in cloud manufacturing environment;10.1109/UV.2018.8642124;IEEE;CHN;2018;supplier selection / service scheduling / cloud manufacturing / multi-objective optimization;undefined
C. Zhao / L. Ren / Y. Laili / L. Lai;An Architecture of Knowledge Cloud Based on Manufacturing Big Data;10.1109/IECON.2018.8591529;IEEE;CHN;2018;cloud manufacturing / big data / knowledge cloud / ontology;internet of things / ontology
A. Vatankhah Barenji / Z. Li / W. M. Wang;Blockchain Cloud Manufacturing: Shop Floor and Machine Level;undescribed;IEEE;Other;2018;undescribed;undefined
K. Kayabay / M. O. Gökalp / P. E. Eren / A. Koçyiğit;[WiP] A Workflow and Cloud Based Service-Oriented Architecture for Distributed Manufacturing in Industry 4.0 Context;10.1109/SOCA.2018.00020;IEEE;Other;2018;workflow / service-oriented architecture / distributed manufacturing / cloud manufacturing / industry 4.0;internet of things / industry 4.0
T. Bai / S. Liu / L. Zhang;A Manufacturing Task Scheduling Method Based on Public Goods Game on Cloud Manufacturing Model;10.1109/UV.2018.8642110;IEEE;CHN;2018;CMfg / sheduling / public goods game / scale-free;undefined
F. Li / L. Zhang / Y. Liu / Y. Laili;QoS-Aware Service Composition in Cloud Manufacturing: A Gale-Shapley Algorithm-Based Approach;10.1109/TSMC.2018.2814686;IEEE;CHN;2018;Cloud manufacturing (CMfg) / Gale-Shapley (GS) algorithm / service composition and optimal-selection;undefined
M. M. Strljic / D. Brovkina / T. Korb / O. Riedel / A. Lechler;Platform architecture concept for the composition of collective cloud manufacturing<sup>*</sup>;10.1109/M2VIP.2018.8600839;IEEE;DEU;2018;undescribed;undefined
M. R. Shahriar / S. M. N. A. Sunny / X. Liu / M. C. Leu / L. Hu / N. Nguyen;MTComm Based Virtualization and Integration of Physical Machine Operations with Digital-Twins in Cyber-Physical Manufacturing Cloud;10.1109/CSCloud/EdgeCom.2018.00018;IEEE;Other;2018;Digital-Twin / Virtualization / MTComm / CPMC / Cyber-Physical Systems / Cyber Manufacturing;industry 4.0
P. Lou / C. Zhu / J. Yan / X. Zhang / J. Hu;The Emergence of Cooperative Behaviors under the Incentive Mechanism of Profit Allocation in a Cloud Manufacturing Environment;10.1109/ICISE.2018.00035;IEEE;Other;2018;Manufacturing collaborative network / cloud manufacture / bipartite network / incentive mechanism / profit allocation / public good game;undefined
X. Gao / Y. Jing / X. Yuan / X. Wang;Clustering and selection method of shaft part manufacturing services on cloud platform;10.1109/ICNSC.2018.8361313;IEEE;CHN;2018;cloud manufacturing / clustering algorithm / extension theory / service selection;industry 4.0
J. Wan / J. Yang / Z. Wang / Q. Hua;Artificial Intelligence for Cloud-Assisted Smart Factory;10.1109/ACCESS.2018.2871724;IEEE;CHN;2018;Artificial intelligence / cloud computing / Industry 4.0 / smart factory;digital manufacturing / cloud computing / industry 4.0
B. Katti / C. Plociennik / M. Ruskowski / M. Schweitzer;SA-OPC-UA: Introducing Semantics to OPC-UA Application Methods;10.1109/COASE.2018.8560467;IEEE;DEU;2018;undescribed;undefined
Y. Singh / I. Saha;Implementing extended producer responsibility into the ERP model;10.1109/EDCT.2018.8405097;IEEE;IND;2018;Extended Producer Responsibility / Waste Management / Enterprise Resource Planning;industry 4.0
B. Chen / J. Wan / A. Celesti / D. Li / H. Abbas / Q. Zhang;Edge Computing in IoT-Based Manufacturing;10.1109/MCOM.2018.1701231;IEEE;Other;2018;undescribed;undefined
C. Morales / K. Henríquez / R. Muoz;Using Big Data for fault diagnosis in legacy manufacturing production lines;10.1109/ICA-ACCA.2018.8609768;IEEE;Other;2018;undescribed;undefined
X. Wang / C. Zhang / Y. Jin / X. Zhao;CPSP: A Cloud-based Production Service Platform Supporting Co-Manufacturing of Cross-Enterprise;10.1109/CSCWD.2018.8465354;IEEE;CHN;2018;cloud manufacturing (eMfg) / service oriented architecture (SOA) / collaborative production;internet of things
P. Ferrari / A. Flammini / E. Sisinni / S. Rinaldi / D. Brandão / M. S. Rocha;Delay Estimation of Industrial IoT Applications Based on Messaging Protocols;10.1109/TIM.2018.2813798;IEEE;ITA;2018;Automation networks / cloud computing / cloud manufacturing (CM) / distributed measurement systems / Industry 4.0 / Internet of Things (IoT) / node-RED;cloud computing / industry 4.0 / internet of things
S. Singh / S. C. Misra;Core challenges to cloud PLM adoption in large manufacturing firms;10.1109/IEA.2018.8387085;IEEE;IND;2018;PLM / cloud / manufacturing / challenges / adoption / internet of things;industry 4.0 / manufacturing / internet of things
S. Cao / Y. Chen / G. Cheng / F. Du / W. Gao / Z. He / S. Li / S. Lun / H. Ma / Q. Su / C. Zhang / T. Zhang / Z. Zhang / J. Zheng / L. Zhou / Y. Fang;Preliminary Study on Evaluation of Smart-Cities Technologies and Proposed UV Lifestyles;10.1109/UV.2018.8642142;IEEE;CHN;2018;Universal Village / Smart Cities / Human-Nature Harmony / Top-Down Design / System Theory / System Dynamics / Connectivity / Mutual Interaction / Mobility / Preventive Healthcare / Well-being / Proactive / Economic Driven / Intelligent Healthcare / Intelligent Transportation Systems / Intelligent Environment;internet of things
H. Tieng / T. Tsai / C. Chen / H. Yang / J. Huang / F. Cheng;Automatic Virtual Metrology and Deformation Fusion Scheme for Engine-Case Manufacturing;10.1109/LRA.2018.2792690;IEEE;TWN;2018;Industry 4.0 / smart factory / aerospace component / engine case (EC) / automatic virtual metrology (AVM) / deformation fusion (DF);industry 4.0
L. Yin / J. Luo / H. Luo;Tasks Scheduling and Resource Allocation in Fog Computing Based on Containers for Smart Manufacturing;10.1109/TII.2018.2851241;IEEE;CHN;2018;Container / fog computing / resource management / smart industry / task scheduling;internet of things / advanced manufacturing
Q. Zheng / J. Li / H. Tian / Z. Wang / S. Wang;A 2-Layers Virtual Network Mapping Algorithm Based on Node Attribute and Network Simplex;10.1109/ACCESS.2018.2883251;IEEE;CHN;2018;Virtual network mapping / network simplex / node attribute / node-ranking approach;undefined
Q. Zhang / F. Li / F. Long / Q. Ling;Vehicle Emission Forecasting Based on Wavelet Transform and Long Short-Term Memory Network;10.1109/ACCESS.2018.2874068;IEEE;CHN;2018;Vehicle emissions forecasting / long short-term memory network / wavelet transform / semi-supervised collaborative training regression;undefined
K. Song / F. Li / F. Long / J. Wang / Q. Ling;Discriminative Deep Feature Learning for Semantic-Based Image Retrieval;10.1109/ACCESS.2018.2862464;IEEE;CHN;2018;Convolutional neural networks / discriminative deep feature learning / improved center loss / semantic-based image retrieval;industry 4.0
H. Li / H. Lv / B. Zhang;Predicting execution time of manufacturing cloud services using BP neural network;10.1109/ICBDA.2017.8078766;IEEE;CHN;2017;cloud manufacturing / execution time prediction / influencing factor / BP neural network;undefined
Q. Lu / J. Feng;Research on Service Selection in Manufacturing Cloud Environment;10.1109/ISCID.2017.199;IEEE;Other;2017;component / Manufacturing cloud / particle swarm / Service selection;undefined
W. He / S. Luan / G. Jia / H. Zong;Resource Allocation Based on Prospect Theory in Cloud Manufacturing Environment;10.1109/ICCSEC.2017.8446962;IEEE;CHN;2017;resource allocation / prospect theory / cloud manufacturing / genetic algorithm;ontology / industry 4.0
P. Jinqi / P. Taiyang / R. Lei;The Supply Chain Network on Cloud Manufacturing Environment Based on COIN Model with Q-Learning Algorithm;10.1109/ES.2017.16;IEEE;Other;2017;undescribed;undefined
N. Nguyen / M. C. Leu / X. F. Liu;Real-time communication for manufacturing cyber-physical systems;10.1109/NCA.2017.8171361;IEEE;Other;2017;Real-time communication / MAC protocol / cyber-physical cloud manufacturing systems;undefined
C. Alexakos / A. Kalogeras;Exposing MES functionalities as enabler for cloud manufacturing;10.1109/WFCS.2017.7991966;IEEE;GRC;2017;Cloud Manufacturing / vertical integration / manufacturing process automation;undefined
J. Chen / G. Q. Huang / J. Wang;Coordination of service clients in cloud manufacturing considering MfgSync;10.1109/COASE.2017.8256116;IEEE;CHN;2017;Cloud manufacturing / Client coordination / Manufacturing synchronization / Service booking and scheduling;undefined
C. J. Huang / F. T. Tsai;Research and development of Cloud manufacturing process system;10.1109/ICASI.2017.7988505;IEEE;TWN;2017;Cloud / manufacturing process / shape component;industry 4.0 / ontology
Y. Lin / M. Hung / H. Huang / C. Chen / H. Yang / Y. Hsieh / F. Cheng;Development of Advanced Manufacturing Cloud of Things (AMCoT)—A Smart Manufacturing Platform;10.1109/LRA.2017.2706859;IEEE;TWN;2017;Advanced manufacturing cloud of things / semiconductor bumping process / smart manufacturing platform / yield enhancement and assurance / zero defects;undefined
S. M. N. A. Sunny / X. F. Liu / M. R. Shahriar;MTComm: A Semantic Ontology Based Internet Scale Communication Method of Manufacturing Services in a Cyber-Physical Manufacturing Cloud;10.1109/IEEE.ICIOT.2017.22;IEEE;Other;2017;Cyber-physical systems / Internet-of-Things / Cyber-Physical Manufacturing Cloud / MTComm / Semantic ontology;internet of things
H. Akbaripour / M. Houshmand / A. Kerdegari;An imperialist competitive algorithm for service composition and optimal selection in cloud manufacturing;10.1109/ISCBI.2017.8053559;IEEE;Other;2017;Cloud Manufacturing / Service Selection / Mixed Integer Programming / Imperialist Competitive Algorithm / Optimization;industry 4.0
C. Xie / H. Cai / L. Xu / L. Jiang / F. Bu;Linked Semantic Model for Information Resource Service Toward Cloud Manufacturing;10.1109/TII.2017.2723501;IEEE;CHN;2017;Cloud manufacturing / information resource / linked data / manufacturing resources / resource service / semantic model / semantic matching;undefined
L. Zhou / L. Zhang / L. Ren / Y. Laili;Matching and selection of distributed 3D printing services in cloud manufacturing;10.1109/IECON.2017.8216815;IEEE;CHN;2017;cloud manufacturing / 3D printing / service matching / service selection;3D printing
W. Li / C. Zhu / L. T. Yang / L. Shu / E. C. -. Ngai / Y. Ma;Subtask Scheduling for Distributed Robots in Cloud Manufacturing;10.1109/JSYST.2015.2438054;IEEE;CHN;2017;Cloud manufacturing (CMF) / deployment / genetic algorithm (GA) / manufacturing robot / task scheduling;industry 4.0 / advanced manufacturing
H. Zheng / Y. Feng / J. Tan;A Hybrid Energy-Aware Resource Allocation Approach in Cloud Manufacturing Environment;10.1109/ACCESS.2017.2715829;IEEE;CHN;2017;Cloud manufacturing / resource allocation / energy consumption / TOPSIS;ontology / advanced manufacturing
G. Luo / Z. Zhang / D. Wu / X. Li / G. Liu;Research on optimization allocation of manufacturing resource services in the cloud environment;10.1109/UIC-ATC.2017.8397635;IEEE;CHN;2017;Cloud Manufacturing / Optimization Allocation / Maximum Inherit Optimization;undefined
J. Wang / L. Qiao / Y. Qie;Process planning service model design for cloud manufacturing;10.1109/COASE.2017.8256261;IEEE;CHN;2017;undescribed;undefined
H. Geng;INTERNET OF THINGS (IoT)‐BASED CYBER–PHYSICAL FRAMEWORKS FOR ADVANCED MANUFACTURING AND MEDICINE;10.1002/9781119173601.ch33;IEEE;Other;2017;undescribed;undefined
